id,name,category,description,address,lat,lng,arr
moulin-rouge-18,Moulin Rouge,culture,Cabaret légendaire French Cancan depuis 1889,82 Boulevard de Clichy 75018,48.8841094,2.3323564,18
montmartre,Montmartre,parc,Butte artistique Place du Tertre peintres,Place du Tertre 75018,48.8865,2.3407,18
basilique-saint-denis,Basilique Saint-Denis,monument,Nécropole royale gothique rayonnant,1 Rue de la Légion d'Honneur 93200,48.9356,2.3598,18
# 19ème arrondissement (3 lieux)
parc-des-buttes-chaumont,Parc des Buttes-Chaumont,parc,25 hectares temple Sibylle lac cascades,1 Rue Botzaris 75019,48.8798,2.3832,19
cite-des-sciences,Cité des Sciences et de l'Industrie,musee,Planétarium Géode expositions interactives,30 Avenue Corentin Cariou 75019,48.8959,2.3877,19
parc-de-la-villette,Parc de la Villette,parc,55 hectares jardins thématiques Philharmonie,211 Avenue Jean Jaurès 75019,48.8938,2.3900,19
# 20ème arrondissement (3 lieux)
pere-lachaise,Cimetière du Père-Lachaise,monument,Plus grand cimetière Paris tombes célèbres,16 Rue du Repos 75020,48.8619,2.3933,20
parc-de-belleville,Parc de Belleville,parc,Vue panoramique 108m altitude vignes,47 Rue des Couronnes 75020,48.8720,2.3829,20
menilmontant,Ménilmontant,culture,Quartier populaire bars alternatifs street art,Rue de Ménilmontant 75020,48.8697,2.3849,20